qs_id,statement_number,statement
QS15,1,"People using adult NHS services are treated with empathy, dignity and respect."
QS15,2,People using adult NHS services understand the roles of healthcare professionals involved in their care and know how to contact them about their ongoing healthcare needs.
QS15,3,People using adult NHS services experience coordinated care with clear and accurate information exchange between relevant health and social care professionals.
QS15,4,People using adult NHS services experience care and treatment that is tailored to their needs and preferences.
QS15,5,"People using adult NHS services have their preferences for sharing information with their family members and carers established, respected and reviewed throughout their care."
QS15,6,People using adult NHS services are supported in shared decision making.
