qs_id,statement_number,statement
QS24,1,People in care settings are screened for the risk of malnutrition using a validated screening tool.
QS24,2,People who are malnourished or at risk of malnutrition have a management care plan that aims to meet their complete nutritional requirements.
QS24,3,"All people who are screened for the risk of malnutrition have their screening results and nutrition support goals (if applicable), documented and communicated in writing within and between settings."
QS24,4,People managing their own artificial nutrition support and/or their carers are trained to manage their nutrition delivery system and monitor their wellbeing.
QS24,5,"People receiving nutrition support are offered a review of the indications, route, risks, benefits and goals of nutrition support at planned intervals."
