qs_id,statement_number,statement
QS50,1,Older people in care homes are offered opportunities during their day to participate in meaningful activity that promotes their health and mental wellbeing.
QS50,2,Older people in care homes are enabled to maintain and develop their personal identity.
QS50,3,Older people in care homes have the symptoms and signs of mental health conditions recognised and recorded as part of their care plan.
QS50,4,Older people in care homes who have specific needs arising from sensory impairment have these recognised and recorded as part of their care plan.
QS50,5,Older people in care homes have the symptoms and signs of physical problems recognised and recorded as part of their care plan.
QS50,6,Older people in care homes have access to the full range of healthcare services when they need them.
