statement_number,measure_type,point,measure_id,measure,numerator,denominator,data_source
1,structure,a,QS83-1-structure-a,Evidence that local crime and related trauma data are used to map the extent of alcohol‑related problems to inform the development or review of a statement of licensing policy.,NA,NA,Local data collection.
2,structure,a,QS83-2-structure-a,Evidence that trading standards and the police are identifying premises that sell alcohol to people under 18.,NA,NA,Local data collection.
2,structure,b,QS83-2-structure-b,Evidence that trading standards and the police are taking action against premises that sell alcohol to people under 18.,NA,NA,Local data collection.
2,outcome,a,QS83-2-outcome-a,Incidence of licensed premises found to sell alcohol to people under 18.,To be determined locally,To be determined locally,Local data collection.
3,structure,a,QS83-3-structure-a,Evidence that schools and colleges include alcohol education in the curriculum.,NA,NA,"Local data collection. Ofsted inspection reports contain information on the achievement of pupils, quality of teaching, behaviour and safety of pupils, and leadership and management for all schools and colleges. Also contained within the Health and Social Care Information Centre's Smoking, Drinking and Drug Use Among Young People in England."
3,outcome,a,QS83-3-outcome-a,Rates of absence from school or college related to alcohol.,To be determined locally,To be determined locally,Local data collection.
4,structure,a,QS83-4-structure-a,"Evidence that schools and colleges involve parents, carers, children and young people in initiatives to reduce alcohol use.",NA,NA,"Local data collection. Ofsted inspection reports contain information on the achievement of pupils, quality of teaching, behaviour and safety of pupils and leadership and management for all schools and colleges."
